{
  "$schema"        : "../schema.json",
  "name"           : "Sfsdirk4",
  "description"    : "Pinned implicit Runge--Kutta tableau for Sfsdirk4.",
  "kind"           : "implicit-runge-kutta",
  "order"          : 4,
  "A"              : [
    ["0.097961082941", "0.0", "0.0", "0.0"],
    ["0.262318069183", "0.097961082941", "0.0", "0.0"],
    ["0.230169419019", "0.294466719347", "0.097961082941", "0.0"],
    ["0.210562684389", "0.26938288828", "0.307008634881", "0.097961082941"]
  ],
  "b"              : ["0.222119403264", "0.282060762166", "0.236881213175", "0.258938621395"],
  "c"              : ["0.097961082941", "0.360279152124", "0.622597221298", "0.884915290491"]
}
