{
  "$schema"     : "../schema.json",
  "name"        : "Ralston4",
  "description" : "Ralston's fixed-step four-stage, fourth-order Runge-Kutta method.",
  "kind"        : "explicit-runge-kutta",
  "order"       : 4,
  "A"           : [
    ["0", "0", "0", "0"],
    ["0.4", "0", "0", "0"],
    ["0.296_977_609_247_753_57", "0.158_759_644_971_035_84", "0", "0"],
    ["0.218_100_388_225_920_04", "-3.050_965_148_692_930_6", "3.832_864_760_467_010_5", "0"]
  ],
  "b"           : ["0.174_760_282_262_690_4", "-0.551_480_662_878_733", "1.205_535_599_396_523_5", "0.171_184_781_219_519_02"],
  "c"           : ["0.0", "0.4", "0.455_737_254_218_789_4", "1.0"]
}
