{
  "$schema"           : "../schema.json",
  "name"              : "Vern7",
  "description"       : "Verner's efficient embedded order-7 explicit Runge--Kutta method.",
  "kind"              : "explicit-runge-kutta",
  "order"             : 7,
  "embedded_order"    : 6,
  "real_stability_radius": 4.64,
  "fsal"              : false,
  "A"                 : [
    [0, 0, 0, 0, 0, 0, 0, 0, 0, 0],
    ["0.005", 0, 0, 0, 0, 0, 0, 0, 0, 0],
    ["-1.07679012345679", "1.185679012345679", 0, 0, 0, 0, 0, 0, 0, 0],
    ["0.04083333333333333", "0.0", "0.1225", 0, 0, 0, 0, 0, 0, 0],
    ["0.6389139236255726", "0.0", "-2.455672638223657", "2.272258714598084", 0, 0, 0, 0, 0, 0],
    ["-2.6615773750187572", "0.0", "10.804513886456137", "-8.3539146573962", "0.820487594956657", 0, 0, 0, 0, 0],
    ["6.067741434696772", "0.0", "-24.711273635911088", "20.427517930788895", "-1.9061579788166472", "1.006172249242068", 0, 0, 0, 0],
    ["12.054670076253203", "0.0", "-49.75478495046899", "41.142888638604674", "-4.461760149974004", "2.042334822239175", "-0.09834843665406107", 0, 0, 0],
    ["10.138146522881808", "0.0", "-42.6411360317175", "35.76384003992257", "-4.3480228403929075", "2.0098622683770357", "0.3487490460338272", "-0.27143900510483127", 0, 0],
    ["-45.030072034298676", "0.0", "187.3272437654589", "-154.02882369350186", "18.56465306347536", "-7.141809679295079", "1.3088085781613787", "0.0", "0.0", 0]
  ],
  "b"                 : ["0.04715561848627222", "0.0", "0.0", "0.25750564298434153", "0.26216653977412624", "0.15216092656738558", "0.4939969170032485", "-0.29430311714032503", "0.08131747232495111", "0.0"],
  "c"                 : ["0.0", "0.005", "0.10888888888888888", "0.16333333333333333", "0.4555", "0.6095094489978381", "0.884", "0.925", "1.0", "1.0"],
  "error"             : ["0.002547011879931045", "0.0", "0.0", "-0.00965839487279575", "0.04206470975639691", "-0.0666822437469301", "0.2650097464621281", "-0.29430311714032503", "0.08131747232495111", "-0.02029518466335628"],
  "dense"             : [
    ["1.0", "-8.413387198332767", "33.675508884490895", "-70.80159089484886", "80.64695108301298", "-47.19413969837522", "11.133813442539243"],
    ["0.0"],
    ["0.0"],
    ["0.0", "8.754921980674396", "-88.4596828699771", "346.9017638429916", "-629.2580030059837", "529.6773755604193", "-167.35886986514018"],
    ["0.0", "8.913387586637922", "-90.06081846893218", "353.1807459217058", "-640.6476819744374", "539.2646279047156", "-170.38809442991547"],
    ["0.0", "5.1733120298478", "-52.271115900055385", "204.9853867374073", "-371.8306118563603", "312.9880934374529", "-98.89290352172495"],
    ["0.0", "16.79537744079696", "-169.70040000059728", "665.4937727009246", "-1207.1638892336007", "1016.1291515818546", "-321.06001557237494"],
    ["0.0", "-10.005997536098665", "101.1005433052275", "-396.47391512378437", "719.1787707014183", "-605.3681033918824", "191.27439892797935"],
    ["0.0", "2.764708833638599", "-27.934602637390462", "109.54779186137893", "-198.7128113064482", "167.26633571640318", "-52.85010499525706"],
    ["0.0"],
    ["0.0", "-2.1696320280163506", "22.016696037569876", "-86.90152427798948", "159.22388973861476", "-135.9618306534588", "43.792401183280006"],
    ["0.0", "-4.890070188793804", "22.75407737425176", "-30.78034218537731", "-2.797194317207249", "31.369456637508403", "-15.655927320381801"],
    ["0.0", "10.862170929551967", "-50.542971417827104", "68.37148040407511", "6.213326521632409", "-69.68006323194157", "34.776056794509195"],
    ["0.0", "-11.37286691922923", "130.79058078246717", "-488.65113677785604", "832.2148793276441", "-664.7743368554426", "201.79288044241662"],
    ["0.0", "-5.919778732715007", "63.27679965889219", "-265.432682088738", "520.1009254140611", "-467.412109533902", "155.3868452824017"],
    ["0.0", "-10.492146197961823", "105.35538525188011", "-409.43975011988937", "732.831448907654", "-606.3044574733512", "188.0495196316683"]
  ],
  "lazy_dense_stages" : [
    {
      "c" : "1.0",
      "A" : [
        {
          "stage" : 0,
          "value" : "0.04715561848627222"
        },
        {
          "stage" : 3,
          "value" : "0.25750564298434153"
        },
        {
          "stage" : 4,
          "value" : "0.2621665397741262"
        },
        {
          "stage" : 5,
          "value" : "0.15216092656738558"
        },
        {
          "stage" : 6,
          "value" : "0.49399691700324844"
        },
        {
          "stage" : 7,
          "value" : "-0.29430311714032503"
        },
        {
          "stage" : 8,
          "value" : "0.0813174723249511"
        }
      ]
    },
    {
      "c" : "0.29",
      "A" : [
        {
          "stage" : 0,
          "value" : "0.0523222769159969"
        },
        {
          "stage" : 3,
          "value" : "0.22495861826705715"
        },
        {
          "stage" : 4,
          "value" : "0.017443709248776376"
        },
        {
          "stage" : 5,
          "value" : "-0.007669379876829393"
        },
        {
          "stage" : 6,
          "value" : "0.03435896044073285"
        },
        {
          "stage" : 7,
          "value" : "-0.0410209723009395"
        },
        {
          "stage" : 8,
          "value" : "0.025651133005205617"
        },
        {
          "stage" : 10,
          "value" : "-0.0160443457"
        }
      ]
    },
    {
      "c" : "0.125",
      "A" : [
        {
          "stage" : 0,
          "value" : "0.053053341257859085"
        },
        {
          "stage" : 3,
          "value" : "0.12195301011401886"
        },
        {
          "stage" : 4,
          "value" : "0.017746840737602496"
        },
        {
          "stage" : 5,
          "value" : "-0.0005928372667681495"
        },
        {
          "stage" : 6,
          "value" : "0.008381833970853752"
        },
        {
          "stage" : 7,
          "value" : "-0.01293369259698612"
        },
        {
          "stage" : 8,
          "value" : "0.009412056815253861"
        },
        {
          "stage" : 10,
          "value" : "-0.005353253107275676"
        },
        {
          "stage" : 11,
          "value" : "-0.06666729992455811"
        }
      ]
    },
    {
      "c" : "0.25",
      "A" : [
        {
          "stage" : 0,
          "value" : "0.03887903257436304"
        },
        {
          "stage" : 3,
          "value" : "-0.0024403203308301317"
        },
        {
          "stage" : 4,
          "value" : "-0.0013928917214672623"
        },
        {
          "stage" : 5,
          "value" : "-0.00047446291558680135"
        },
        {
          "stage" : 6,
          "value" : "0.00039207932413159514"
        },
        {
          "stage" : 7,
          "value" : "-0.00040554733285128004"
        },
        {
          "stage" : 8,
          "value" : "0.00019897093147716726"
        },
        {
          "stage" : 10,
          "value" : "-0.00010278198793179169"
        },
        {
          "stage" : 11,
          "value" : "0.03385661513870267"
        },
        {
          "stage" : 12,
          "value" : "0.1814893063199928"
        }
      ]
    },
    {
      "c" : "0.53",
      "A" : [
        {
          "stage" : 0,
          "value" : "0.05723681204690013"
        },
        {
          "stage" : 3,
          "value" : "0.22265948066761182"
        },
        {
          "stage" : 4,
          "value" : "0.12344864200186899"
        },
        {
          "stage" : 5,
          "value" : "0.04006332526666491"
        },
        {
          "stage" : 6,
          "value" : "-0.05269894848581452"
        },
        {
          "stage" : 7,
          "value" : "0.04765971214244523"
        },
        {
          "stage" : 8,
          "value" : "-0.02138895885042213"
        },
        {
          "stage" : 10,
          "value" : "0.015193891064036402"
        },
        {
          "stage" : 11,
          "value" : "0.12060546716289655"
        },
        {
          "stage" : 12,
          "value" : "-0.022779423016187374"
        }
      ]
    },
    {
      "c" : "0.79",
      "A" : [
        {
          "stage" : 0,
          "value" : "0.051372038802756814"
        },
        {
          "stage" : 3,
          "value" : "0.5414214473439406"
        },
        {
          "stage" : 4,
          "value" : "0.350399806692184"
        },
        {
          "stage" : 5,
          "value" : "0.14193112269692182"
        },
        {
          "stage" : 6,
          "value" : "0.10527377478429423"
        },
        {
          "stage" : 7,
          "value" : "-0.031081847805874016"
        },
        {
          "stage" : 8,
          "value" : "-0.007401883149519145"
        },
        {
          "stage" : 10,
          "value" : "-0.006377932504865363"
        },
        {
          "stage" : 11,
          "value" : "-0.17325495908361865"
        },
        {
          "stage" : 12,
          "value" : "-0.18228156777622026"
        }
      ]
    }
  ]
}
