{
  "$schema"     : "../schema.json",
  "name"        : "Rkm",
  "description" : "The fixed-step six-stage, fourth-order Mead-Renaut Runge-Kutta method.",
  "kind"        : "explicit-runge-kutta",
  "order"       : 4,
  "A"           : [
    ["0", "0", "0", "0", "0", "0"],
    ["0.167_266_187_050_662", "0", "0", "0", "0", "0"],
    ["0.0", "0.484_574_582_244_783", "0", "0", "0", "0"],
    ["0.0", "0.0", "0.536_909_403_373_491", "0", "0", "0"],
    ["0.0", "0.0", "0.0", "0.082_069_535_961_948", "0", "0"],
    ["0.0", "0.0", "0.0", "0.0", "0.853_923_000_035_347", "0"]
  ],
  "b"           : ["-0.028_289_441_132_839", "0.463_968_918_564_71", "-0.434_414_348_751_899", "0.693_796_229_087_598", "0.0", "0.304_938_642_232_43"],
  "c"           : ["0.0", "0.167_266_187_050_662", "0.484_574_582_244_783", "0.536_909_403_373_491", "0.082_069_535_961_948", "0.853_923_000_035_347"]
}
