{
  "$schema"        : "../schema.json",
  "name"           : "Hairer42",
  "description"    : "Pinned implicit Runge--Kutta tableau for Hairer42.",
  "kind"           : "implicit-runge-kutta",
  "order"          : 4,
  "embedded_order" : 3,
  "A"              : [
    ["0.26666666666666666", "0.0", "0.0", "0.0", "0.0"],
    ["0.5", "0.26666666666666666", "0.0", "0.0", "0.0"],
    ["0.3541539528432732", "-0.054153952843273234", "0.26666666666666666", "0.0", "0.0"],
    ["0.08515494131138653", "-0.06484332287891555", "0.07915325296404206", "0.26666666666666666", "0.0"],
    ["2.1001157005669326", "-0.7677800284445977", "2.3998163610800263", "-2.998818699869028", "0.26666666666666666"]
  ],
  "b"              : ["2.1001157005669326", "-0.7677800284445977", "2.3998163610800263", "-2.998818699869028", "0.26666666666666666"],
  "c"              : ["0.26666666666666666", "0.7666666666666667", "0.5666666666666667", "0.36613153806317966", "1.0"],
  "error"          : ["0.7851485038202615", "0.6219006801483206", "-0.009807678614886406", "-1.130574838687029", "-0.26666666666666666"]
}
