{
  "$schema"        : "../schema.json",
  "name"           : "KenCarp4",
  "description"    : "Pinned implicit Runge--Kutta tableau for KenCarp4.",
  "kind"           : "implicit-runge-kutta",
  "order"          : 4,
  "embedded_order" : 3,
  "A"              : [
    ["0.0", "0.0", "0.0", "0.0", "0.0", "0.0"],
    ["0.25", "0.25", "0.0", "0.0", "0.0", "0.0"],
    ["0.137776", "-0.055776", "0.25", "0.0", "0.0", "0.0"],
    ["0.14463686602698217", "-0.22393190761334475", "0.4492950415863626", "0.25", "0.0", "0.0"],
    ["0.09825878328356477", "-0.5915442428196704", "0.8101210538282996", "0.283164405707806", "0.25", "0.0"],
    ["0.15791629516167136", "0.0", "0.18675894052400077", "0.6805652953093346", "-0.27524053099500667", "0.25"]
  ],
  "b"              : ["0.15791629516167136", "0.0", "0.18675894052400077", "0.6805652953093346", "-0.27524053099500667", "0.25"],
  "c"              : ["0.0", "0.5", "0.332", "0.62", "0.85", "1.0"],
  "error"          : ["-0.0032044943984591845", "0.0", "0.002446251136679456", "0.021480075919587227", "-0.0439468680685724", "0.02322503541076487"]
}
