{
  "$schema"     : "../schema.json",
  "name"        : "Msrk6",
  "description" : "The fixed-step eight-stage, sixth-order Misha Stepanov Runge-Kutta method.",
  "kind"        : "explicit-runge-kutta",
  "order"       : 6,
  "fsal"        : true,
  "A"           : [
    ["0", "0", "0", "0", "0", "0", "0", "0", "0"],
    ["1.0 / 14.0", "0", "0", "0", "0", "0", "0", "0", "0"],
    ["0.0", "1.0 / 7.0", "0", "0", "0", "0", "0", "0", "0"],
    ["3.0 / 56.0", "0.0", "9.0 / 56.0", "0", "0", "0", "0", "0", "0"],
    ["29.0 / 72.0", "0.0", "-35.0 / 24.0", "14.0 / 9.0", "0", "0", "0", "0", "0"],
    ["-17.0 / 56.0", "0.0", "93.0 / 56.0", "-8.0 / 7.0", "3.0 / 7.0", "0", "0", "0", "0"],
    ["199.0 / 1372.0", "0.0", "-195.0 / 196.0", "1259.0 / 784.0", "-3855.0 / 5488.0", "45.0 / 56.0", "0", "0", "0"],
    ["4903.0 / 25596.0", "0.0", "4487.0 / 2844.0", "-255101.0 / 102384.0", "33847.0 / 11376.0", "-94325.0 / 51192.0", "3773.0 / 6399.0", "0", "0"],
    ["16.0 / 243.0", "0.0", "0.0", "16807.0 / 53460.0", "53.0 / 300.0", "2401.0 / 12150.0", "2401.0 / 12150.0", "79.0 / 1650.0", "0"]
  ],
  "b"           : ["16.0 / 243.0", "0.0", "0.0", "16807.0 / 53460.0", "53.0 / 300.0", "2401.0 / 12150.0", "2401.0 / 12150.0", "79.0 / 1650.0", "0.0"],
  "c"           : ["0.0", "1.0 / 14.0", "1.0 / 7.0", "3.0 / 14.0", "1.0 / 2.0", "9.0 / 14.0", "6.0 / 7.0", "1.0", "1.0"]
}
