{
  "$schema"        : "../schema.json",
  "name"           : "ImexSsp222",
  "description"    : "Pinned implicit Runge--Kutta tableau for ImexSsp222.",
  "kind"           : "implicit-runge-kutta",
  "order"          : 2,
  "A"              : [
    ["0.29289321881345254", "0.0"],
    ["0.41421356237309515", "0.29289321881345254"]
  ],
  "b"              : ["0.5", "0.5"],
  "c"              : ["0.29289321881345254", "0.7071067811865475"]
}
