{
  "$schema"     : "../schema.json",
  "name"        : "SspRk83",
  "description" : "Fixed-step strong-stability-preserving SspRk83 Runge--Kutta method.",
  "kind"        : "explicit-runge-kutta",
  "order"       : 3,
  "A"           : [
    [0, 0, 0, 0, 0, 0, 0, 0],
    ["0.195_804_015_330_143", 0, 0, 0, 0, 0, 0, 0],
    ["0.195_804_015_330_143", "0.195_804_015_330_143", 0, 0, 0, 0, 0, 0],
    ["0.195_804_015_330_143", "0.195_804_015_330_143", "0.195_804_015_330_143", 0, 0, 0, 0, 0],
    ["0.195_804_015_330_143", "0.195_804_015_330_143", "0.195_804_015_330_143", "0.195_804_015_330_143", 0, 0, 0, 0],
    ["0.113_298_671_247_345_7", "0.112_133_754_621_672_92", "0.112_133_754_621_672_92", "0.112_133_754_621_672_92", "0.112_133_754_621_673_01", 0, 0, 0],
    ["0.113_649_649_861_106_04", "0.111_656_736_433_452_77", "0.111_656_736_433_452_77", "0.111_656_736_433_452_77", "0.111_656_736_433_452_85", "0.194_971_062_960_412", 0, 0],
    ["0.142_210_235_791_870_03", "0.140_910_149_518_052_14", "0.120_472_098_379_644_22", "0.072_839_787_419_852_71", "0.072_839_787_419_852_77", "0.127_190_272_908_641_66", "0.127_733_653_231_943_99", 0]
  ],
  "b"           : ["0.142_210_235_791_870_03", "0.140_910_149_518_052_14", "0.120_472_098_379_644_22", "0.072_839_787_419_852_71", "0.072_839_787_419_852_77", "0.127_190_272_908_641_66", "0.127_733_653_231_943_99", "0.195_804_015_330_143"],
  "c"           : ["0.0", "0.195_804_015_330_143", "0.391_608_030_660_286", "0.587_412_045_990_429", "0.783_216_061_320_572", "0.561_833_689_734_037", "0.755_247_658_555_329", "0.804_195_984_669_857"]
}
