{
  "$schema"           : "../schema.json",
  "name"              : "Bs5",
  "description"       : "The adaptive Bogacki-Shampine 5/4 method with two error estimators.",
  "kind"              : "explicit-runge-kutta",
  "order"             : 5,
  "embedded_order"    : 4,
  "fsal"              : true,
  "A"                 : [
    ["0", "0", "0", "0", "0", "0", "0", "0"],
    ["1.0 / 6.0", "0", "0", "0", "0", "0", "0", "0"],
    ["2.0 / 27.0", "4.0 / 27.0", "0", "0", "0", "0", "0", "0"],
    ["183.0 / 1_372.0", "-162.0 / 343.0", "1_053.0 / 1_372.0", "0", "0", "0", "0", "0"],
    ["68.0 / 297.0", "-4.0 / 11.0", "42.0 / 143.0", "1_960.0 / 3_861.0", "0", "0", "0", "0"],
    ["597.0 / 22_528.0", "81.0 / 352.0", "63_099.0 / 585_728.0", "58_653.0 / 366_080.0", "4_617.0 / 20_480.0", "0", "0", "0"],
    ["174_197.0 / 959_244.0", "-30_942.0 / 79_937.0", "8_152_137.0 / 19_744_439.0", "666_106.0 / 1_039_181.0", "-29_421.0 / 29_068.0", "482_048.0 / 414_219.0", "0", "0"],
    ["587.0 / 8_064.0", "0.0", "4_440_339.0 / 15_491_840.0", "24_353.0 / 124_800.0", "387.0 / 44_800.0", "2_152.0 / 5_985.0", "7_267.0 / 94_080.0", "0"]
  ],
  "b"                 : ["587.0 / 8_064.0", "0.0", "4_440_339.0 / 15_491_840.0", "24_353.0 / 124_800.0", "387.0 / 44_800.0", "2_152.0 / 5_985.0", "7_267.0 / 94_080.0", "0.0"],
  "c"                 : ["0.0", "1.0 / 6.0", "2.0 / 9.0", "3.0 / 7.0", "2.0 / 3.0", "3.0 / 4.0", "1.0", "1.0"],
  "error"             : ["-3.0 / 1_280.0", "0.0", "6_561.0 / 632_320.0", "-343.0 / 20_800.0", "243.0 / 12_800.0", "-1.0 / 95.0", "0.0", "0.0"],
  "second_error"      : ["-3_817.0 / 1_959_552.0", "0.0", "140_181.0 / 15_491_840.0", "-4_224_731.0 / 272_937_600.0", "8_557.0 / 403_200.0", "-57_928.0 / 4_363_065.0", "-23_930_231.0 / 4_366_535_040.0", "3_293.0 / 556_956.0"],
  "dense"             : [
    ["1.0", "-8.103191118438032", "27.298136302807084", "-45.470343197183475", "36.89579791207878", "-11.547607240534195"],
    ["0.0"],
    ["0.0", "-3.4362921012159933", "28.38602193195626", "-72.2759709558427", "74.85879078710211", "-27.245925284262768"],
    ["0.0", "-1.3276772735189397", "13.060399314592578", "-35.469854845413806", "38.240038148817945", "-14.307769126529058"],
    ["0.0", "-0.16393430643430643", "0.8847786781120115", "-1.964240395021645", "1.9817123385873385", "-0.7296779223862557"],
    ["0.0", "3.9253203306051474", "-34.163041154825144", "77.4690381021765", "-65.9928405785889", "19.121088881250603"],
    ["0.0", "-1.853826530612245", "16.83892431972789", "-42.4062818877551", "42.17455357142857", "-14.676126700680273"],
    ["0.0", "2.3125", "-21.078125", "53.671875", "-54.359375", "19.453125"],
    ["0.0", "0.0", "-2.3333333333333335", "23.0", "-39.0", "18.333333333333332"],
    ["0.0", "-3.3528990003856314", "30.106238940962648", "-73.55422182095978", "70.20132282057416", "-23.400440940191388"],
    ["0.0", "12.0", "-59.0", "117.0", "-105.0", "35.0"]
  ],
  "lazy_dense_stages" : [
    {
      "A" : [
        {
          "stage" : 0,
          "value" : "0.07405598958333333"
        },
        {
          "stage" : 2,
          "value" : "0.28964485093442743"
        },
        {
          "stage" : 3,
          "value" : "0.12839214966168092"
        },
        {
          "stage" : 4,
          "value" : "-0.003779296875"
        },
        {
          "stage" : 5,
          "value" : "0.014230019493177388"
        },
        {
          "stage" : 6,
          "value" : "-0.03379371279761905"
        },
        {
          "stage" : 7,
          "value" : "0.03125"
        }
      ],
      "c" : "0.5"
    },
    {
      "A" : [
        {
          "stage" : 0,
          "value" : "-0.06358724036162344"
        },
        {
          "stage" : 1,
          "value" : "0.5742461924818869"
        },
        {
          "stage" : 2,
          "value" : "-0.06365063007249953"
        },
        {
          "stage" : 3,
          "value" : "0.043159777438314964"
        },
        {
          "stage" : 4,
          "value" : "0.8370112883898733"
        },
        {
          "stage" : 5,
          "value" : "-0.34045447246719235"
        },
        {
          "stage" : 6,
          "value" : "0.04926503818334922"
        },
        {
          "stage" : 7,
          "value" : "-0.006882677669165967"
        },
        {
          "stage" : 8,
          "value" : "-0.19577394258960973"
        }
      ],
      "c" : "0.8333333333333334"
    },
    {
      "A" : [
        {
          "stage" : 0,
          "value" : "0.0636090772400987"
        },
        {
          "stage" : 1,
          "value" : "0.01057854182854183"
        },
        {
          "stage" : 2,
          "value" : "0.06600100945670531"
        },
        {
          "stage" : 3,
          "value" : "0.02048391555358402"
        },
        {
          "stage" : 4,
          "value" : "0.003682270330219549"
        },
        {
          "stage" : 5,
          "value" : "0.155258632271002"
        },
        {
          "stage" : 6,
          "value" : "-0.08509702513818027"
        },
        {
          "stage" : 7,
          "value" : "0.1"
        },
        {
          "stage" : 8,
          "value" : "-0.1"
        },
        {
          "stage" : 9,
          "value" : "-0.12340531043086005"
        }
      ],
      "c" : "0.1111111111111111"
    }
  ]
}
