{
  "$schema"        : "../schema.json",
  "name"           : "RKIP",
  "description"    : "Verner 6(5) pair used by the RKIP interaction-picture solver.",
  "kind"           : "explicit-runge-kutta",
  "order"          : 6,
  "embedded_order" : 5,
  "A"              : [
    ["0.0", "0.0", "0.0", "0.0", "0.0", "0.0", "0.0", "0.0"],
    ["1.0 / 7.0", "0.0", "0.0", "0.0", "0.0", "0.0", "0.0", "0.0"],
    ["4.0 / 81.0", "14.0 / 81.0", "0.0", "0.0", "0.0", "0.0", "0.0", "0.0"],
    ["291.0 / 1372.0", "-27.0 / 49.0", "1053.0 / 1372.0", "0.0", "0.0", "0.0", "0.0", "0.0"],
    ["86.0 / 297.0", "-14.0 / 33.0", "42.0 / 143.0", "1960.0 / 3861.0", "0.0", "0.0", "0.0", "0.0"],
    ["-267.0 / 22528.0", "189.0 / 704.0", "63099.0 / 585728.0", "58653.0 / 366080.0", "4617.0 / 20480.0", "0.0", "0.0", "0.0"],
    ["10949.0 / 6912.0", "-69.0 / 32.0", "-90891.0 / 68096.0", "112931.0 / 25920.0", "-69861.0 / 17920.0", "26378.0 / 10773.0", "0.0", "0.0"],
    ["1501.0 / 19008.0", "-21.0 / 88.0", "219519.0 / 347776.0", "163807.0 / 926640.0", "-417.0 / 640.0", "1544.0 / 1539.0", "0.0", "0.0"]
  ],
  "b"              : ["79.0 / 1080.0", "0.0", "19683.0 / 69160.0", "16807.0 / 84240.0", "0.0", "2816.0 / 7695.0", "1.0 / 100.0", "187.0 / 2800.0"],
  "b_hat"          : ["763.0 / 10800.0", "0.0", "59049.0 / 197600.0", "88837.0 / 526500.0", "243.0 / 4000.0", "12352.0 / 38475.0", "0.0", "2.0 / 25.0"],
  "c"              : ["0.0", "1.0 / 7.0", "2.0 / 9.0", "3.0 / 7.0", "2.0 / 3.0", "3.0 / 4.0", "1.0", "1.0"]
}
