{
  "$schema"        : "../schema.json",
  "name"           : "Ars222",
  "description"    : "Pinned implicit Runge--Kutta tableau for Ars222.",
  "kind"           : "implicit-runge-kutta",
  "order"          : 2,
  "A"              : [
    ["0.0", "0.0", "0.0"],
    ["0.0", "0.29289321881345254", "0.0"],
    ["0.0", "0.7071067811865475", "0.29289321881345254"]
  ],
  "b"              : ["0.0", "0.7071067811865475", "0.29289321881345254"],
  "c"              : ["0.0", "0.29289321881345254", "1.0"]
}
