{
  "$schema"        : "../schema.json",
  "name"           : "Kvaerno3",
  "description"    : "Pinned implicit Runge--Kutta tableau for Kvaerno3.",
  "kind"           : "implicit-runge-kutta",
  "order"          : 3,
  "embedded_order" : 2,
  "A"              : [
    ["0.0", "0.0", "0.0", "0.0"],
    ["0.4358665215", "0.4358665215", "0.0", "0.0"],
    ["0.490563388419108", "0.073570090080892", "0.4358665215", "0.0"],
    ["0.308809969973036", "1.490563388254106", "-1.235239879727145", "0.4358665215"]
  ],
  "b"              : ["0.308809969973036", "1.490563388254106", "-1.235239879727145", "0.4358665215"],
  "c"              : ["0.0", "0.4358665215", "1.0", "1.0"],
  "error"          : ["0.181753418446072", "-1.416993298173214", "1.671106401227145", "-0.4358665215"]
}
