{
  "$schema"        : "../schema.json",
  "name"           : "TsitPap8",
  "description"    : "Tsitouras--Papakostas eighth-order explicit Runge--Kutta method.",
  "kind"           : "explicit-runge-kutta",
  "order"          : 8,
  "embedded_order" : 7,
  "fsal"           : false,
  "A"              : [
    [0, 0, 0, 0, 0, 0, 0, 0, 0, 0, 0, 0, 0],
    ["0.063380281690140844", 0, 0, 0, 0, 0, 0, 0, 0, 0, 0, 0, 0],
    ["0.019438980427336498", "0.083348965449027812", 0, 0, 0, 0, 0, 0, 0, 0, 0, 0, 0],
    ["0.038545479703636615", "0.0000000000000000", "0.11563643911090984", 0, 0, 0, 0, 0, 0, 0, 0, 0, 0],
    ["0.39436557770112496", "0.0000000000000000", "-1.4818719321673373", "1.4751032536910185", 0, 0, 0, 0, 0, 0, 0, 0, 0],
    ["0.045994489107698204", "0.0000000000000000", "0.0000000000000000", "0.23235070626395474", "0.18740822928588133", 0, 0, 0, 0, 0, 0, 0, 0],
    ["0.060052289532440510", "0.0000000000000000", "0.0000000000000000", "0.11220383194636775", "-0.033572329519061417", "0.016721613445658576", 0, 0, 0, 0, 0, 0, 0],
    ["-1.5733292732086857", "0.0000000000000000", "0.0000000000000000", "-1.3167087730223663", "-11.723515296181773", "9.1078250281738722", "6.5128205128205128", 0, 0, 0, 0, 0, 0],
    ["-0.48107625624391254", "0.0000000000000000", "0.0000000000000000", "-6.6506103607463904", "-4.5302060997825722", "3.8944145250201569", "8.6342176455255260", "0.0094016247886814976", 0, 0, 0, 0, 0],
    ["-0.77541214462305685", "0.0000000000000000", "0.0000000000000000", "-7.9966047182358322", "-6.7265586072301824", "5.5321844543274059", "10.897573320249910", "0.020091650280045396", "-0.039186042680376856", 0, 0, 0, 0],
    ["-1.1896363245449992", "0.0000000000000000", "0.0000000000000000", "-7.1283684833012142", "-9.5372278971010793", "7.5744701089808677", "11.267486382070919", "0.051009801223058315", "0.080194134695082561", "-0.15819617839847347", 0, 0, 0],
    ["-0.39200039047127266", "0.0000000000000000", "0.0000000000000000", "3.9166590424938561", "-2.8017459289080557", "2.4412045664817419", "-2.4183655778824718", "-0.33943326290032927", "0.19496450383103364", "-0.19437176762508154", "0.59308881498057908", 0, 0],
    ["0.044411610932501518", "0.0000000000000000", "0.0000000000000000", "0.0000000000000000", "0.0000000000000000", "0.35395063113733116", "0.24852196841849650", "-0.33269131717206663", "1.9212488286528360", "-2.7317783000882523", "1.4012004409899175", "0.095136137129236506", 0]
  ],
  "b"              : ["0.044411610932501518", "0.0000000000000000", "0.0000000000000000", "0.0000000000000000", "0.0000000000000000", "0.35395063113733116", "0.24852196841849650", "-0.33269131717206663", "1.9212488286528360", "-2.7317783000882523", "1.4012004409899175", "0.095136137129236506", "0.0000000000000000"],
  "c"              : ["0.0000000000000000", "0.063380281690140844", "0.10278794587636431", "0.15418191881454646", "0.38759689922480622", "0.46575342465753422", "0.15540540540540540", "1.0070921985815602", "0.87614107856148904", "0.91208791208791207", "0.95973154362416102", "1.0000000000000000", "1.0000000000000000"],
  "error"          : ["-0.000072590917828026263", "0.0000000000000000", "0.0000000000000000", "0.0000000000000000", "0.0000000000000000", "-0.0010728916072503584", "0.00026666683457943977", "2.0915339790963952", "0.32131867524286661", "-0.92101367139528401", "1.4012004409899175", "0.095136137129236506", "-2.9872967453726327"]
}
