{
  "$schema"        : "../schema.json",
  "name"           : "Cash4",
  "description"    : "Pinned fourth-order Cash SDIRK tableau with its third-order embedding.",
  "kind"           : "implicit-runge-kutta",
  "order"          : 4,
  "embedded_order" : 3,
  "A"              : [
    ["0.435866521508", 0, 0, 0, 0],
    ["-1.1358665215", "0.435866521508", 0, 0, 0],
    ["1.08543330679", "-0.721299828287", "0.435866521508", 0, 0],
    ["0.416349501547", "0.190984004184", "-0.118643265417", "0.435866521508", 0],
    ["0.896869652944", "0.0182725272734", "-0.0845900310706", "-0.266418670647", "0.435866521508"]
  ],
  "b"              : ["0.896869652944", "0.0182725272734", "-0.0845900310706", "-0.266418670647", "0.435866521508"],
  "c"              : ["0.435866521508", "-0.7", "0.8", "0.924556761814", 1],
  "error"          : ["0.77669193291 - 0.896869652944", "0.0297472791484 - 0.0182725272734", "-0.0267440239074 - (-0.0845900310706)", "0.220304811849 - (-0.266418670647)", "-0.435866521508"]
}
