{
  "$schema"     : "../schema.json",
  "name"        : "Rko65",
  "description" : "Tsitouras' six-stage, fifth-order Runge-Kutta-Oliver method.",
  "kind"        : "explicit-runge-kutta",
  "order"       : 5,
  "A"           : [
    ["0", "0", "0", "0", "0", "0", "0"],
    ["0.0", "0", "0", "0", "0", "0", "0"],
    ["0.0", "1.0 / 6.0", "0", "0", "0", "0", "0"],
    ["0.0", "-15.0 / 8.0", "21.0 / 8.0", "0", "0", "0", "0"],
    ["0.0", "-9.0", "75.0 / 7.0", "-5.0 / 7.0", "0", "0", "0"],
    ["0.0", "-3.0", "34257.0 / 8750.0", "-114.0 / 875.0", "19.0 / 1250.0", "0", "0"],
    ["0.0", "0.0", "123.0 / 380.0", "5.0 / 2.0", "3.0 / 20.0", "-75.0 / 38.0", "0"]
  ],
  "b"           : ["0.0", "0.0", "54.0 / 133.0", "32.0 / 21.0", "1.0 / 18.0", "-125.0 / 114.0", "1.0 / 9.0"],
  "c"           : ["0.0", "2.0 / 3.0", "1.0 / 6.0", "3.0 / 4.0", "1.0", "4.0 / 5.0", "1.0"]
}
